{
  "$schema": "https://json-schema.org/draft/2020-12/schema",
  "$id": "https://video2pdf.local/schemas/delivery-quality/v1/text-origin-manifest.v1.schema.json",
  "type": "object",
  "additionalProperties": false,
  "required": ["schema_name", "schema_version", "activation_status", "compiler_provider", "precompile_text_seal_sha256", "final_artifact_seal_sha256", "rendered_text_inventory_sha256", "edges", "manifest_sha256"],
  "properties": {
    "schema_name": {"const": "text-origin-manifest"},
    "schema_version": {"const": "1.0.0"},
    "activation_status": {"const": "target_only"},
    "compiler_provider": {"type": "object", "additionalProperties": false, "required": ["provider_id", "provider_sha256"], "properties": {"provider_id": {"type": "string", "minLength": 1}, "provider_sha256": {"$ref": "#/$defs/sha256"}}},
    "precompile_text_seal_sha256": {"$ref": "#/$defs/sha256"},
    "final_artifact_seal_sha256": {"$ref": "#/$defs/sha256"},
    "rendered_text_inventory_sha256": {"$ref": "#/$defs/sha256"},
    "edges": {"type": "array", "minItems": 1, "items": {"type": "object", "required": ["edge_id", "disposition", "rendered_object_ids", "recipe"], "properties": {"edge_id": {"type": "string", "minLength": 1}, "disposition": {"type": "string", "minLength": 1}, "sealed_item_id": {"type": "string", "minLength": 1}, "sealed_text_utf8": {"type": "string"}, "rendered_object_ids": {"type": "array", "minItems": 1, "items": {"type": "string", "minLength": 1}}, "recipe": {"type": "string", "minLength": 1}, "generator": {"type": "object"}}}},
    "manifest_sha256": {"$ref": "#/$defs/sha256"}
  },
  "$defs": {"sha256": {"type": "string", "pattern": "^[0-9a-f]{64}$"}}
}
