{"schema_name":"text-origin-manifest","schema_version":"1.0.0","activation_status":"target_only","compiler_provider":{"provider_id":"guarded-xelatex","provider_sha256":"1111111111111111111111111111111111111111111111111111111111111111"},"precompile_text_seal_sha256":"2222222222222222222222222222222222222222222222222222222222222222","final_artifact_seal_sha256":"3333333333333333333333333333333333333333333333333333333333333333","rendered_text_inventory_sha256":"4444444444444444444444444444444444444444444444444444444444444444","edges":[{"edge_id":"origin.1","disposition":"sealed_origin","sealed_item_id":"item.1","sealed_text_utf8":"example","rendered_object_ids":["p1.text.1"],"recipe":"exact_utf8"}],"manifest_sha256":"5555555555555555555555555555555555555555555555555555555555555555"}
